{
  "key": "zamowienie",
  "displayName": "Zamówienie",
  "family": "order",
  "capabilities": {
    "hasVat": false,
    "hasKSeFFields": false,
    "hasPaymentBlock": false,
    "hasItemTable": true,
    "itemTablePriceVisible": true,
    "hasWarehouseBlock": false,
    "hasSignatureBlock": false,
    "hasCarrierBlock": false,
    "hasCorrectionReference": false,
    "hasAdvanceReference": false,
    "isLegalDocument": false,
    "requiresSellerNip": false,
    "requiresBuyerNip": false,
    "requiresLegalFooter": false,
    "allowedLocales": ["pl", "en"],
    "defaultLocale": "pl"
  },
  "requiredSections": [
    "header",
    "seller_buyer",
    "document_meta",
    "items_table"
  ],
  "forbiddenSections": [],
  "lockedSections": [],
  "requiredBindings": [
    "document.number",
    "document.issueDate",
    "items[*].name",
    "items[*].quantity"
  ],
  "legalConstraintRuleSetKey": "ORDER_DEFAULT",
  "defaultSections": [
    "header",
    "seller_buyer",
    "document_meta",
    "items_table",
    "notes"
  ],
  "allowedBlockTypes": [
    "document_title",
    "document_number",
    "document_dates",
    "company_identity",
    "counterparty_identity",
    "items_table",
    "totals_table",
    "notes"
  ],
  "forbiddenBlockTypes": [
    "legal_footer"
  ],
  "allowedItemTableColumnSets": ["order_basic", "order_with_delivery"],
  "sectionHeightEstimates": {
    "header": 80,
    "seller_buyer": 120,
    "document_meta": 70,
    "items_table": 250,
    "notes": 90
  }
}
